{
  "event_id": "22222222-2222-4222-8222-222222222222",
  "event_type": "tpb.telegram.delivery.requested",
  "event_version": 1,
  "occurred_at": "2026-08-23T12:00:05Z",
  "correlation_id": "aaaaaaaa-aaaa-4aaa-8aaa-aaaaaaaaaaaa",
  "causation_id": "11111111-1111-4111-8111-111111111111",
  "aggregate_type": "digest_message",
  "aggregate_id": "message-1001-0",
  "attempt": 1,
  "generation": 1,
  "payload": {
    "message_id": "message-1001-0",
    "run_id": "run-1001",
    "ordinal": 0
  }
}
